{
  "schema_version": "1.0.0",
  "pack_metadata": {
    "pack_id": "journey.05.deceased-assets",
    "title": "Discover and claim a deceased person's Central and regulated financial assets",
    "user_outcome": "Build an evidence-backed inventory of possible assets, route each asset to the correct institution, and preserve separate proof of discovery, submission, and successful transmission or payment.",
    "central_scope": "India-wide Central-government and regulated-sector routes for bank deposits, listed securities and demat holdings, mutual funds, life insurance, EPF/EPS/EDLI, NPS, IEPF-held shares or amounts, and Central small-savings or postal accounts. A death certificate is assumed to exist.",
    "explicit_exclusions": [
      "A national determination of inheritance, beneficial ownership, or the effect of nomination under personal law",
      "State-specific legal-heir certificates, stamp duty, registration, notarisation practice, probate, succession-certificate, or letters-of-administration procedure",
      "Real property, state-cooperative institutions, unregulated investments, private debts, tax filing, and estate administration outside the named asset classes",
      "Any assurance of entitlement, interest, limitation, fee, waiver, threshold, or completion time not supported by a current cited primary source"
    ],
    "verification_date": "2026-08-28",
    "overall_readiness": "Action Required"
  },
  "qualifying_questions": [
    {"id":"q.death-proof","question":"Do you have a verifiable death certificate, and does each institution's record match the deceased person's name and date of birth?","why_it_matters":"Every covered claim route requires death evidence; identity mismatches can stop discovery or transmission.","answer_type":"document","options":[],"affects_task_ids":["t.inventory","t.bank-claim","t.demat-claim","t.physical-securities-claim","t.mf-claim","t.insurance-claim","t.epf-claim","t.eps-claim","t.edli-claim","t.nps-claim","t.iepf-claim","t.postal-claim"],"blocking_logic":"If no verifiable death proof exists, stop all claim-submission tasks; this pack assumes it exists but does not assume record matching.","evidence_status":"Verified"},
    {"id":"q.claimant-capacity","question":"For each asset, are you a surviving joint holder, registered nominee, executor or administrator, or a legal heir without a recorded nomination?","why_it_matters":"The institution's record and claimant capacity determine the route and documents; one capacity cannot be reused across assets without confirmation.","answer_type":"multi_select","options":["surviving joint holder","registered nominee","executor or administrator","legal heir","guardian for minor claimant","unknown"],"affects_task_ids":["t.route-claimant","t.bank-claim","t.demat-claim","t.physical-securities-claim","t.mf-claim","t.insurance-claim","t.epf-claim","t.eps-claim","t.edli-claim","t.nps-claim","t.iepf-claim","t.postal-claim"],"blocking_logic":"Unknown or unverified capacity blocks final entitlement and may require institution, state-authority, or court evidence.","evidence_status":"Verified"},
    {"id":"q.dispute-will","question":"Is there a will, a competing claimant, a court restraint, or a dispute about the asset?","why_it_matters":"The simplified SEBI transmission framework excludes disputed or competing claims, and banks must respect court restraints; testate and intestate routes are case dependent.","answer_type":"multi_select","options":["no known dispute or restraint","will exists","competing claim","court restraint","unknown"],"affects_task_ids":["t.route-claimant","t.bank-claim","t.demat-claim","t.physical-securities-claim","t.mf-claim","t.nps-claim","t.iepf-claim","t.postal-claim"],"blocking_logic":"A competing claim, restraint, or unresolved will-related authority stops automated happy-path routing and requires institution-specific and possibly judicial handling.","evidence_status":"Verified"},
    {"id":"q.asset-leads","question":"Which asset clues exist: bank name/account, PAN or identity number, demat/DP details, folio, policy, UAN/PF account, PRAN/employer, company/folio, or post-office passbook/certificate?","why_it_matters":"There is no verified single deceased-asset registry in this research; each asset class has different discovery inputs.","answer_type":"multi_select","options":["bank","demat or listed securities","mutual fund","insurance","EPF/EPS/EDLI","NPS","IEPF","post-office or small savings","none known"],"affects_task_ids":["t.inventory","t.udgam-search","t.securities-locate","t.mitra-search","t.insurance-locate","t.epfo-classify","t.nps-classify","t.iepf-locate","t.postal-classify"],"blocking_logic":"No clue does not prove no asset exists; it leaves unsupported asset classes Action Required.","evidence_status":"Unavailable"},
    {"id":"q.bank-status","question":"Is the bank deposit active, known to the bank, or returned by UDGAM as an unclaimed deposit?","why_it_matters":"UDGAM is a discovery and bank-link service, not a claim portal; all claims go to the bank.","answer_type":"single_select","options":["active or known account","UDGAM match","unknown","no bank asset"],"affects_task_ids":["t.udgam-search","t.bank-claim","t.bank-grievance"],"blocking_logic":"A UDGAM match enables a bank claim but does not establish claimant entitlement or payment.","evidence_status":"Verified"},
    {"id":"q.securities-mode","question":"Are the securities in demat, physical certificates or statement-of-account form, or already transferred to IEPF?","why_it_matters":"The destination is respectively the DP, issuer/RTA/AMC, or the company/RTA plus MCA-IEPF route.","answer_type":"single_select","options":["demat","physical listed securities","mutual-fund statement of account","IEPF","unknown"],"affects_task_ids":["t.securities-locate","t.demat-claim","t.physical-securities-claim","t.mf-claim","t.iepf-locate","t.iepf-claim"],"blocking_logic":"Unknown mode blocks submission until the DP, issuer/RTA, AMC/RTA, or company record is identified.","evidence_status":"Verified"},
    {"id":"q.sebi-value","question":"What is the value per beneficial-owner account or per issuer/AMC record on the institution's valuation date?","why_it_matters":"The 2026 SEBI transmission circular applies different QTP, simplified, and above-threshold evidence routes.","answer_type":"number","options":[],"affects_task_ids":["t.demat-claim","t.physical-securities-claim","t.mf-claim","t.iepf-claim"],"blocking_logic":"Do not select a SEBI transmission document band until the regulated entity establishes the applicable record and value.","evidence_status":"Verified"},
    {"id":"q.insurance-lead","question":"Do you know the insurer, policy number, employer/group-policy link, or only an unclaimed-amount lead?","why_it_matters":"The Bima Bharosa page is an insurer directory; the death claim is submitted to the insurer or servicing branch.","answer_type":"single_select","options":["insurer and policy known","insurer known, policy unknown","group/employer lead","unclaimed-amount lead","no lead"],"affects_task_ids":["t.insurance-locate","t.insurance-claim","t.insurance-grievance"],"blocking_logic":"No insurer or policy lead leaves discovery incomplete; it does not establish that no cover existed.","evidence_status":"Candidate"},
    {"id":"q.epfo-facts","question":"What are the UAN/PF account and employer, and did death occur while in service; was the establishment exempted; what family, age, service, and nomination facts apply?","why_it_matters":"PF, family pension and EDLI are separate claims with different claimant and event conditions.","answer_type":"text","options":[],"affects_task_ids":["t.epfo-classify","t.epf-claim","t.eps-claim","t.edli-claim","t.epfo-grievance"],"blocking_logic":"Do not infer EPS or EDLI eligibility from a PF balance; unverified service, family, age, or exempted-establishment facts remain Action Required.","evidence_status":"Verified"},
    {"id":"q.nps-facts","question":"What are the PRAN, sector (government or non-government), CRA, associated nodal office/POP, nomination record, and date/circumstances of death?","why_it_matters":"Government and non-government death exits differ, and a live official FAQ conflicts with the current consolidated regulation on a government-sector threshold.","answer_type":"text","options":[],"affects_task_ids":["t.nps-classify","t.nps-claim","t.nps-grievance"],"blocking_logic":"Unknown sector or nomination blocks entitlement routing; government-sector amount options require current CRA/nodal confirmation because of the recorded conflict.","evidence_status":"Conflict"},
    {"id":"q.iepf-facts","question":"Which company, folio/demat account, shares/dividends and original holder are involved, and has the company/RTA accepted the transmission evidence?","why_it_matters":"IEPF-5 needs company-level details and company/bank verification; the SEBI transmission framework also applies to securities transferred to IEPF.","answer_type":"text","options":[],"affects_task_ids":["t.iepf-locate","t.iepf-claim","t.central-grievance"],"blocking_logic":"Unknown company/folio or unresolved transmission evidence blocks a reliable IEPF-5 claim.","evidence_status":"Verified"},
    {"id":"q.postal-facts","question":"Which scheme and account office apply, is there a nomination or surviving holder, what is the eligible balance, and have six months elapsed where no legal evidence is produced?","why_it_matters":"Central small-savings succession is scheme and fact dependent; the ₹5 lakh rule and available legal-evidence routes cannot be generalized without confirmation.","answer_type":"text","options":[],"affects_task_ids":["t.postal-classify","t.postal-claim","t.central-grievance"],"blocking_logic":"Do not select Forms 11/13/14/15 or a court/state document route until the account office confirms scheme, nomination, amount, and current rule set.","evidence_status":"Conflict"}
  ],
  "tasks": [